Version Date,5/8/2026
Primary contacts,Jen Stamp (Jen.Stamp@tetratech.com) and Don Zaroban
,
Taxon_orig,taxon name from the original source file
Name type,scientific or common name (we can accommodate either; common names will be translated to scientific names during the 'taxa translate' step)
OTU_BCG_v1,"TaxaID_orig translated to an ID that is used for the Lower Boise River fish BCG (version 1) metric calculations. It harmonizes differences such as syntax, changes in nomenclature, misspellings, etc. DNI = not included. "
Modified_BCG_v1,yes = Taxon_orig is different from the OTU_BCG_v1; no = TaxaID_orig is the same as the OTU_BCG_v1
Rationale_modifyBCG,"reason for modifying OTU_BCG_v1 (e.g., formatting, spelling)"
OTU_AllFish_v1,same as OTU_BCG_v1 except non-target taxa (DNIs) are included (where appropriate)
